{
  "$schema": "../theme.schema.json",
  "slug": "example",
  "name": "Sunset example",
  "signIn": "Sunset",
  "description": "A warm example theme. Add example/theme.json to themes/index.json to try it.",
  "author": "Splitter",
  "light": {
    "--bg": "#fff8f2",
    "--panel": "#ffffff",
    "--text": "#2b1a12",
    "--muted": "#7a5c4b",
    "--border": "#f0d8c6",
    "--accent": "#c2410c",
    "--accent-soft": "rgba(194, 65, 12, 0.1)",
    "--on-accent": "#ffffff",
    "--warn": "#b91c1c",
    "--shadow": "0 1px 2px rgba(43, 26, 18, 0.06), 0 2px 8px rgba(43, 26, 18, 0.04)"
  },
  "dark": {
    "--bg": "#1a120d",
    "--panel": "#261a13",
    "--text": "#f8ede5",
    "--muted": "#c9a995",
    "--border": "#4a3226",
    "--accent": "#ff8f36",
    "--accent-soft": "rgba(255, 143, 54, 0.16)",
    "--on-accent": "#2a1206",
    "--warn": "#ff8a8a",
    "--shadow": "none"
  }
}
